{
    "$schema": "https://raw.githubusercontent.com/isi-usc-edu/qb-gsee-benchmark/main/schemas/performance_metrics.schema.0.0.1.json",
    "performance_metrics_uuid": "081f384b-cdcd-42de-8dc7-5117b0876996",
    "solver_short_name": "DF_QPE",
    "solver_uuid": "5d768520-b3d0-4292-bbb4-9776fa128107",
    "creation_timestamp": "2026-04-07T11:49:13.945074+00:00",
    "ml_metrics": {
        "solvability_ratio": 0.0394,
        "comments": "solvability ratio based on PCA embedding.",
        "f1_score": [
            1.0,
            1.0
        ],
        "ml_metrics_calculator_version": 1
    },
    "top_level_results": {
        "number_of_problem_instances": 68,
        "number_of_problem_instances_attempted": 24,
        "number_of_problem_instances_solved": 2,
        "number_of_tasks": 228,
        "number_of_tasks_attempted": 137,
        "number_of_tasks_solved": 2,
        "number_of_tasks_solved_within_run_time_limit": 2,
        "number_of_tasks_solved_within_accuracy_threshold": 137,
        "max_run_time_of_attempted_tasks": 71881480309304.23,
        "sum_of_run_time_of_attempted_tasks": 92303779438561.5
    },
    "results_by_problem_instance": [
        {
            "problem_instance_uuid": "dc8bdc56-5ebd-4996-6b81-81b1a06d8c76",
            "solution_uuid": "70019442-e381-40c5-b5d0-a9a2f155ee1e",
            "number_of_tasks": 12,
            "number_of_tasks_attempted": 12,
            "number_of_tasks_solved_within_runtime_limit": 0,
            "number_of_tasks_solved_within_accuracy_requirement": 12,
            "number_of_tasks_solved": 0,
            "sum_of_run_time_of_attempted_tasks": 1071622854449.7314,
            "max_run_time_of_attempted_tasks": 505208801839.9823,
            "solution_submitted_by_due_date": true
        },
        {
            "problem_instance_uuid": "766ba2da-e72a-4e03-a739-f97269026fc4",
            "solution_uuid": "420d66c0-8ce2-4df9-ba02-c7a6a3f25ea2",
            "number_of_tasks": 1,
            "number_of_tasks_attempted": 1,
            "number_of_tasks_solved_within_runtime_limit": 0,
            "number_of_tasks_solved_within_accuracy_requirement": 1,
            "number_of_tasks_solved": 0,
            "sum_of_run_time_of_attempted_tasks": 201417693.350765,
            "max_run_time_of_attempted_tasks": 201417693.350765,
            "solution_submitted_by_due_date": true
        },
        {
            "problem_instance_uuid": "664ec8e4-09d5-41cc-6266-ddb26219366f",
            "solution_uuid": "d02728c0-fd80-45ab-bc2b-071acc937166",
            "number_of_tasks": 4,
            "number_of_tasks_attempted": 4,
            "number_of_tasks_solved_within_runtime_limit": 0,
            "number_of_tasks_solved_within_accuracy_requirement": 4,
            "number_of_tasks_solved": 0,
            "sum_of_run_time_of_attempted_tasks": 12927341361.316359,
            "max_run_time_of_attempted_tasks": 5230897378.991123,
            "solution_submitted_by_due_date": true
        },
        {
            "problem_instance_uuid": "614c4444-a31a-4348-b24d-01040208651c",
            "solution_uuid": null,
            "number_of_tasks": 30,
            "number_of_tasks_attempted": 0,
            "number_of_tasks_solved_within_runtime_limit": 0,
            "number_of_tasks_solved_within_accuracy_requirement": 0,
            "number_of_tasks_solved": 0,
            "sum_of_run_time_of_attempted_tasks": null,
            "max_run_time_of_attempted_tasks": null,
            "solution_submitted_by_due_date": false
        },
        {
            "problem_instance_uuid": "3f141f05-532b-478d-b38a-2ae07baadc88",
            "solution_uuid": "d1ca05b7-ef02-4b30-bfe5-4872e26b85d3",
            "number_of_tasks": 3,
            "number_of_tasks_attempted": 2,
            "number_of_tasks_solved_within_runtime_limit": 0,
            "number_of_tasks_solved_within_accuracy_requirement": 2,
            "number_of_tasks_solved": 0,
            "sum_of_run_time_of_attempted_tasks": 8666088673.070866,
            "max_run_time_of_attempted_tasks": 8263644415.001101,
            "solution_submitted_by_due_date": true
        },
        {
            "problem_instance_uuid": "1c3155e0-3679-4eff-bed0-57a1082672c3",
            "solution_uuid": "bd630d73-2bda-41d6-8537-762939fd2bc5",
            "number_of_tasks": 3,
            "number_of_tasks_attempted": 2,
            "number_of_tasks_solved_within_runtime_limit": 0,
            "number_of_tasks_solved_within_accuracy_requirement": 2,
            "number_of_tasks_solved": 0,
            "sum_of_run_time_of_attempted_tasks": 1296506224074.1013,
            "max_run_time_of_attempted_tasks": 1286927597226.498,
            "solution_submitted_by_due_date": true
        },
        {
            "problem_instance_uuid": "a8895776-3583-4884-fbc7-d6f9df21a7ac",
            "solution_uuid": "0364de32-21b8-465d-8286-bfc8e9b7eedd",
            "number_of_tasks": 9,
            "number_of_tasks_attempted": 9,
            "number_of_tasks_solved_within_runtime_limit": 0,
            "number_of_tasks_solved_within_accuracy_requirement": 9,
            "number_of_tasks_solved": 0,
            "sum_of_run_time_of_attempted_tasks": 41923036592.73371,
            "max_run_time_of_attempted_tasks": 7133916866.2664385,
            "solution_submitted_by_due_date": true
        },
        {
            "problem_instance_uuid": "e48e7467-1fcd-478b-a599-f4ce881c57b9",
            "solution_uuid": null,
            "number_of_tasks": 3,
            "number_of_tasks_attempted": 2,
            "number_of_tasks_solved_within_runtime_limit": 0,
            "number_of_tasks_solved_within_accuracy_requirement": 2,
            "number_of_tasks_solved": 0,
            "sum_of_run_time_of_attempted_tasks": 5511024660.096926,
            "max_run_time_of_attempted_tasks": 5306292912.596156,
            "solution_submitted_by_due_date": false
        },
        {
            "problem_instance_uuid": "c2009f9f-4738-4919-9295-5f9231ca5199",
            "solution_uuid": null,
            "number_of_tasks": 16,
            "number_of_tasks_attempted": 0,
            "number_of_tasks_solved_within_runtime_limit": 0,
            "number_of_tasks_solved_within_accuracy_requirement": 0,
            "number_of_tasks_solved": 0,
            "sum_of_run_time_of_attempted_tasks": null,
            "max_run_time_of_attempted_tasks": null,
            "solution_submitted_by_due_date": false
        },
        {
            "problem_instance_uuid": "2e61ba35-b6b0-42b5-b3e8-d25bd83145ba",
            "solution_uuid": "3c4adbae-2248-47e8-93c0-d39d0a4a932a",
            "number_of_tasks": 3,
            "number_of_tasks_attempted": 2,
            "number_of_tasks_solved_within_runtime_limit": 0,
            "number_of_tasks_solved_within_accuracy_requirement": 2,
            "number_of_tasks_solved": 0,
            "sum_of_run_time_of_attempted_tasks": 925027475677.9215,
            "max_run_time_of_attempted_tasks": 843856528253.3472,
            "solution_submitted_by_due_date": true
        },
        {
            "problem_instance_uuid": "8a3787cc-d3d0-42a8-d9a9-7de2aed45208",
            "solution_uuid": "5e4afee4-3169-4337-8c9b-48e5892df995",
            "number_of_tasks": 16,
            "number_of_tasks_attempted": 16,
            "number_of_tasks_solved_within_runtime_limit": 0,
            "number_of_tasks_solved_within_accuracy_requirement": 16,
            "number_of_tasks_solved": 0,
            "sum_of_run_time_of_attempted_tasks": 14083631394238.574,
            "max_run_time_of_attempted_tasks": 7234554349266.43,
            "solution_submitted_by_due_date": true
        },
        {
            "problem_instance_uuid": "c1e4c7dd-2dc4-4dd0-889d-fb34f602965a",
            "solution_uuid": null,
            "number_of_tasks": 2,
            "number_of_tasks_attempted": 1,
            "number_of_tasks_solved_within_runtime_limit": 0,
            "number_of_tasks_solved_within_accuracy_requirement": 1,
            "number_of_tasks_solved": 0,
            "sum_of_run_time_of_attempted_tasks": 659000639491.4393,
            "max_run_time_of_attempted_tasks": 659000639491.4393,
            "solution_submitted_by_due_date": false
        },
        {
            "problem_instance_uuid": "00043d56-ed63-4266-907c-99c95c51b9db",
            "solution_uuid": "894d6ff2-e581-49f1-bf9d-7ca6b087fc52",
            "number_of_tasks": 1,
            "number_of_tasks_attempted": 1,
            "number_of_tasks_solved_within_runtime_limit": 0,
            "number_of_tasks_solved_within_accuracy_requirement": 1,
            "number_of_tasks_solved": 0,
            "sum_of_run_time_of_attempted_tasks": 71881480309304.23,
            "max_run_time_of_attempted_tasks": 71881480309304.23,
            "solution_submitted_by_due_date": true
        },
        {
            "problem_instance_uuid": "a14a1e28-71c5-4e23-bf6e-dd9662a6df58",
            "solution_uuid": "7fd61f5c-9ef8-4561-a70f-002442003ca4",
            "number_of_tasks": 2,
            "number_of_tasks_attempted": 1,
            "number_of_tasks_solved_within_runtime_limit": 0,
            "number_of_tasks_solved_within_accuracy_requirement": 1,
            "number_of_tasks_solved": 0,
            "sum_of_run_time_of_attempted_tasks": 137174245097.45984,
            "max_run_time_of_attempted_tasks": 137174245097.45984,
            "solution_submitted_by_due_date": true
        },
        {
            "problem_instance_uuid": "1448d27d-bfa9-470f-a6c8-864a295b66f4",
            "solution_uuid": null,
            "number_of_tasks": 2,
            "number_of_tasks_attempted": 1,
            "number_of_tasks_solved_within_runtime_limit": 0,
            "number_of_tasks_solved_within_accuracy_requirement": 1,
            "number_of_tasks_solved": 0,
            "sum_of_run_time_of_attempted_tasks": 241839333327.2801,
            "max_run_time_of_attempted_tasks": 241839333327.2801,